<?xml version="1.0" encoding="UTF-8"?>
<bookings xmlns:xsi="http://www.w3.org/2001/XMLSchema-instance"
          xsi:noNamespaceSchemaLocation="../xsd/booking.xsd">

  <booking id="1">
    <passengerId>1</passengerId>
    <flightId>1</flightId>
    <bookingDate>2025-08-10T09:00:00</bookingDate>
  </booking>

  <booking id="2">
    <passengerId>2</passengerId>
    <flightId>1</flightId>
    <bookingDate>2025-08-10T09:05:00</bookingDate>
  </booking>

</bookings>